{
  "$schema": "http://json-schema.org/draft-07/schema#",
  "title": "EvaluationCase",
  "description": "A deterministic evaluation case. Pure evaluation only - never references a candidate skill or any optimization-loop concept.",
  "type": "object",
  "required": ["id", "name", "skill", "schema_version", "prompt", "checks"],
  "additionalProperties": false,
  "properties": {
    "schema_version": {
      "const": 1,
      "description": "Bumped when the case schema makes a breaking change."
    },
    "id": {
      "type": "string",
      "pattern": "^eval-[0-9]{3}$",
      "description": "Stable case identifier, e.g. 'eval-001'."
    },
    "name": {
      "type": "string",
      "pattern": "^[a-z0-9][a-z0-9-]*$",
      "description": "Lowercase-kebab slug used in filenames and bundle dirs."
    },
    "skill": {
      "type": "string",
      "description": "The skill this case targets, e.g. 'cesiumjs-camera'."
    },
    "description": {
      "type": "string",
      "description": "Human-readable purpose of the case. Not consumed by the runner."
    },
    "category": {
      "type": "string",
      "enum": [
        "archive_baseline_review",
        "execution_health",
        "semantic_scene_state",
        "camera_framing",
        "visual_fidelity",
        "asset_and_provider_safety",
        "interaction_behavior",
        "time_behavior",
        "source_contract",
        "artifact_hygiene",
        "public_reproducibility"
      ],
      "description": "Primary scorecard category for this case."
    },
    "critical": {
      "type": "boolean",
      "default": true,
      "description": "Whether a failure in this case should fail the scorecard gate."
    },
    "prompt": {
      "type": "string",
      "description": "Exact prompt issued to the implementation. Should specify the deterministic outcome so an LLM-free check can verify it."
    },
    "preflight": {
      "type": "object",
      "description": "Optional fixture state established before running the candidate. The runner is responsible for putting the scene into this state.",
      "additionalProperties": true
    },
    "probe": {
      "type": "object",
      "description": "Which scene-state values to capture before/after the candidate runs.",
      "additionalProperties": false,
      "properties": {
        "capture": {
          "type": "array",
          "minItems": 1,
          "items": {
            "type": "string",
            "pattern": "^(generated_code|execution\\.success|errors|scene_state|screenshot_quality|screenshots|camera\\.(position_ecef|direction_ecef|up_ecef|heading_pitch_roll|position_cartographic)|entities\\[[^\\]]+\\]\\.(position_ecef|position_cartographic|properties|orientation|scale)|imagery_layers\\[\\*\\]\\.[A-Za-z0-9_]+|primitives\\[\\*\\]\\.[A-Za-z0-9_]+|tilesets\\[\\*\\]\\.[A-Za-z0-9_]+|data_sources\\[\\*\\]\\.[A-Za-z0-9_]+|clock\\.[A-Za-z0-9_]+|globe\\.[A-Za-z0-9_]+|scene\\.[A-Za-z0-9_]+|terrain\\.[A-Za-z0-9_]+|events\\.[A-Za-z0-9_]+|before\\.values\\.[A-Za-z0-9_]+|after\\.values\\.[A-Za-z0-9_]+)$"
          },
          "description": "Normalized evidence fields the capture layer must collect. Use wildcard collection paths such as imagery_layers[*].provider and concrete entity paths such as entities[marker].position_ecef."
        },
        "snapshot_before_and_after": {
          "type": "boolean"
        },
        "snapshot_after": {
          "type": "boolean"
        },
        "before_trigger": {
          "type": "string"
        },
        "after_trigger": {
          "type": "string"
        },
        "actual_source": {
          "type": "string",
          "description": "Optional provenance path for imported baseline-observed evidence."
        }
      },
      "required": ["capture"]
    },
    "checks": {
      "type": "array",
      "minItems": 1,
      "items": { "$ref": "check.schema.json" },
      "description": "Deterministic assertions. All must pass for the case to pass."
    },
    "timeout_ms": {
      "type": "integer",
      "minimum": 100,
      "default": 5000
    },
    "notes": {
      "type": "string"
    }
  }
}
