{
  "category": "archive_baseline_review",
  "checks": [
    {
      "category": "execution_health",
      "critical": true,
      "description": "No JS errors",
      "id": "no_runtime_errors_00",
      "type": "no_runtime_errors"
    },
    {
      "category": "execution_health",
      "critical": true,
      "description": "No runtime exceptions",
      "id": "code_runs_01",
      "type": "code_runs"
    },
    {
      "category": "generated_output_semantics",
      "critical": true,
      "description": "Uses Model.fromGltfAsync",
      "id": "pattern_present_02",
      "pattern": "Model\\.fromGltfAsync",
      "type": "pattern_present"
    },
    {
      "category": "generated_output_semantics",
      "critical": true,
      "description": "Builds quaternion from axis-angle",
      "id": "pattern_present_03",
      "pattern": "Quaternion\\.fromAxisAngle",
      "type": "pattern_present"
    },
    {
      "category": "generated_output_semantics",
      "critical": true,
      "description": "Converts quaternion to Matrix3",
      "id": "pattern_present_04",
      "pattern": "Matrix3\\.fromQuaternion",
      "type": "pattern_present"
    },
    {
      "category": "generated_output_semantics",
      "critical": true,
      "description": "Composes matrices with Matrix4.multiply",
      "id": "pattern_present_05",
      "pattern": "Matrix4\\.multiply",
      "type": "pattern_present"
    },
    {
      "category": "generated_output_semantics",
      "critical": true,
      "description": "Uses ENU local frame",
      "id": "pattern_present_06",
      "pattern": "Transforms\\.eastNorthUpToFixedFrame",
      "type": "pattern_present"
    },
    {
      "category": "generated_output_semantics",
      "critical": true,
      "description": "Converts degrees to radians",
      "id": "pattern_present_07",
      "pattern": "(?:CesiumMath|Cesium\\.Math)\\.toRadians",
      "type": "pattern_present"
    },
    {
      "category": "generated_output_semantics",
      "critical": true,
      "description": "Uses UNIT_Z axis",
      "id": "pattern_present_08",
      "pattern": "Cartesian3\\.UNIT_Z",
      "type": "pattern_present"
    }
  ],
  "critical": false,
  "description": "Load the public CesiumAir glb model and construct its modelMatrix from a Quaternion built via Quaternion.fromAxisAngle with the local up axis (Cartesian3.UNIT_Z) and an angle of Cesium.Math.toRadians(45) or CesiumMath.toRadians(45) \u2014 so the aircraft's nose points northeast in the local east-north-up frame. Then compose with Matrix4.fromTranslationQuaternionRotationScale (or equivalent). Tests Quaternion.fromAxisAngle, Matrix3.fromQuaternion, and Matrix4 composition.",
  "id": "eval-103",
  "name": "archive-quaternion-heading-marker",
  "notes": "Imported from optimization/scenarios/cesiumjs-spatial-math/eval-003. Expected source/runtime contracts are scenario-authored; actual values are observed from the archived baseline generated JS and browser artifacts.",
  "preflight": {
    "difficulty": "hard",
    "expected_behaviors": [
      "Calls Model.fromGltfAsync with the public CesiumAir glb URL",
      "Calls Quaternion.fromAxisAngle with an axis vector and an angle from Cesium.Math.toRadians or CesiumMath.toRadians",
      "Uses Matrix3.fromQuaternion to build a rotation matrix",
      "Composes the rotation with an ENU frame from Transforms.eastNorthUpToFixedFrame via Matrix4.multiply",
      "Origin coordinates are around -115.17 W, 36.11 N (Las Vegas) at non-zero altitude",
      "Sets minimumPixelSize on the model so it's visible from camera distance",
      "Adds the model to viewer.scene.primitives",
      "Frames the camera close to the aircraft"
    ],
    "landmark": "CesiumAir aircraft rotated via Quaternion",
    "perspective": "framed aircraft with non-default rotation",
    "source": "optimization/scenarios",
    "source_name": "quaternion-heading-marker",
    "source_scenario_id": "eval-003",
    "visual_expectations": "The Cesium Air aircraft visible above terrain (Las Vegas desert area), with its nose pointing toward the northeast rather than straight north (the default). The yaw should be clearly non-zero \u2014 the aircraft should appear rotated about its vertical axis."
  },
  "probe": {
    "actual_source": "observed baseline run artifacts",
    "capture": [
      "generated_code",
      "execution.success",
      "errors",
      "scene_state",
      "screenshot_quality"
    ],
    "snapshot_before_and_after": false
  },
  "prompt": "Load the public Cesium Air model from https://raw.githubusercontent.com/CesiumGS/cesium/main/Apps/SampleData/models/CesiumAir/Cesium_Air.glb using Model.fromGltfAsync with scale 50, minimumPixelSize 300. Build the modelMatrix: origin Cartesian3.fromDegrees(-115.1735, 36.1146, 3000). Compose Transforms.eastNorthUpToFixedFrame(origin) as the ENU frame, then build Quaternion.fromAxisAngle(Cartesian3.UNIT_Z, Cesium.Math.toRadians(45)) for a 45-deg yaw, Matrix3.fromQuaternion(q) for rotation matrix, Matrix4.fromRotationTranslation(rot3, Cartesian3.ZERO) for the 4x4. Final modelMatrix = Matrix4.multiply(enuFrame, rotMatrix4, new Matrix4()). Add model to scene.primitives. Frame from above-behind using explicit camera coords (NOT viewer.flyTo of the model): viewer.camera.setView({ destination: Cesium.Cartesian3.fromDegrees(-115.1755, 36.1130, 3200), orientation: { heading: Cesium.Math.toRadians(30), pitch: Cesium.Math.toRadians(-25), roll: 0 } }) \u2014 looking northeast-and-down at the aircraft from 250 m away so its 45-deg yaw is clearly visible.",
  "schema_version": 1,
  "skill": "cesiumjs-spatial-math",
  "timeout_ms": 5000
}
