{
  "category": "archive_baseline_review",
  "checks": [
    {
      "category": "execution_health",
      "critical": true,
      "description": "No JS errors",
      "id": "no_runtime_errors_00",
      "type": "no_runtime_errors"
    },
    {
      "category": "execution_health",
      "critical": true,
      "description": "No runtime exceptions",
      "id": "code_runs_01",
      "type": "code_runs"
    },
    {
      "category": "generated_output_semantics",
      "critical": true,
      "description": "Uses WMTS provider",
      "id": "pattern_present_02",
      "pattern": "WebMapTileServiceImageryProvider",
      "type": "pattern_present"
    },
    {
      "category": "generated_output_semantics",
      "critical": true,
      "description": "Sets tileMatrixSetID",
      "id": "pattern_present_03",
      "pattern": "tileMatrixSetID",
      "type": "pattern_present"
    },
    {
      "category": "generated_output_semantics",
      "critical": true,
      "description": "Uses the working USGS WMTS tile matrix set",
      "id": "pattern_present_04",
      "pattern": "GoogleMapsCompatible",
      "type": "pattern_present"
    },
    {
      "category": "generated_output_semantics",
      "critical": true,
      "description": "Targets USGS WMTS service",
      "id": "pattern_present_05",
      "pattern": "USGSShadedReliefOnly|WMTS",
      "type": "pattern_present"
    },
    {
      "category": "generated_output_semantics",
      "critical": true,
      "description": "Targets Grand Canyon region",
      "id": "pattern_present_06",
      "pattern": "-112|36\\.",
      "type": "pattern_present"
    }
  ],
  "critical": false,
  "description": "Use a public WMTS service for shaded relief and center the map on the Grand Canyon. Tests required WMTS fields.",
  "id": "eval-105",
  "name": "archive-usgs-shaded-relief-wmts-grand-canyon",
  "notes": "Imported from optimization/scenarios/cesiumjs-imagery/eval-005. Expected source/runtime contracts are scenario-authored; actual values are observed from the archived baseline generated JS and browser artifacts.",
  "preflight": {
    "difficulty": "medium",
    "expected_behaviors": [
      "Creates a WebMapTileServiceImageryProvider",
      "Sets url, layer, style, format, and tileMatrixSetID",
      "Adds the provider to the viewer imagery layers",
      "Frames the Grand Canyon"
    ],
    "landmark": "Grand Canyon, USA",
    "perspective": "regional shaded relief base map",
    "source": "optimization/scenarios",
    "source_name": "usgs-shaded-relief-wmts-grand-canyon",
    "source_scenario_id": "eval-005",
    "visual_expectations": "A shaded-relief style map over the Grand Canyon region with clear terrain texture and canyon form visible from above. The visual assessment uses a four-shot cardinal panorama (north, east, south, west) from the settled viewer state; the subject should remain understandable across the panorama, and grading considers all screenshots together.",
    "screenshot_mode": "cardinal_panorama"
  },
  "probe": {
    "actual_source": "observed baseline run artifacts",
    "capture": [
      "generated_code",
      "execution.success",
      "errors",
      "scene_state",
      "screenshot_quality"
    ],
    "snapshot_before_and_after": false
  },
  "prompt": "Create a CesiumJS viewer using the public USGS shaded relief WMTS imagery as the main visible layer, then position the camera over the Grand Canyon. Use a WebMapTileServiceImageryProvider with url `https://basemap.nationalmap.gov/arcgis/rest/services/USGSShadedReliefOnly/MapServer/WMTS`, layer `USGSShadedReliefOnly`, style `default`, format `image/jpgpng`, tileMatrixSetID `GoogleMapsCompatible`, and `maximumLevel: 8` because this service returns errors for the higher zooms requested by close camera heights. Start the viewer with this provider as the explicit base layer or with baseLayer false before adding it, so no default ion imagery is loaded. Use a regional camera height high enough to stay within level 8. The result should look like a terrain-style shaded relief map rather than satellite photography.",
  "schema_version": 1,
  "skill": "cesiumjs-imagery",
  "timeout_ms": 5000
}
