{
  "category": "archive_baseline_review",
  "checks": [
    {
      "category": "execution_health",
      "critical": true,
      "description": "No JS errors",
      "id": "no_runtime_errors_00",
      "type": "no_runtime_errors"
    },
    {
      "category": "execution_health",
      "critical": true,
      "description": "No runtime exceptions",
      "id": "code_runs_01",
      "type": "code_runs"
    },
    {
      "category": "generated_output_semantics",
      "critical": true,
      "description": "Uses lookAt",
      "id": "pattern_present_02",
      "pattern": "lookAt",
      "type": "pattern_present"
    },
    {
      "category": "generated_output_semantics",
      "critical": true,
      "description": "Uses HeadingPitchRange",
      "id": "pattern_present_03",
      "pattern": "HeadingPitchRange",
      "type": "pattern_present"
    },
    {
      "category": "generated_output_semantics",
      "critical": true,
      "description": "Heading ~270 degrees",
      "id": "pattern_present_04",
      "pattern": "270|3.*Math\\.PI.*2|4\\.71",
      "type": "pattern_present"
    },
    {
      "category": "generated_output_semantics",
      "critical": true,
      "description": "Releases lookAt lock",
      "id": "pattern_present_05",
      "pattern": "lookAtTransform",
      "type": "pattern_present"
    }
  ],
  "critical": false,
  "description": "View the Eiffel Tower from the east, looking west. Tests heading=270 with lookAt. Complements eval-003 (from south) for directional coverage.",
  "id": "eval-113",
  "name": "archive-eiffel-tower-from-east",
  "notes": "Imported from optimization/scenarios/cesiumjs-camera/eval-013. Expected source/runtime contracts are scenario-authored; actual values are observed from the archived baseline generated JS and browser artifacts.",
  "preflight": {
    "difficulty": "medium",
    "expected_behaviors": [
      "Uses lookAt with HeadingPitchRange",
      "Heading ~270 degrees (facing west = camera is east of target)",
      "Pitch ~-20 degrees",
      "Range ~1200m",
      "Releases lookAt lock afterward with lookAtTransform(Matrix4.IDENTITY)"
    ],
    "landmark": "Eiffel Tower, Paris",
    "perspective": "mid-altitude from east",
    "source": "optimization/scenarios",
    "source_name": "eiffel-tower-from-east",
    "source_scenario_id": "eval-013",
    "visual_expectations": "The Eiffel Tower area from the east. The Champ de Mars gardens should extend to the west (behind the tower position). The Seine River should be visible to the south. Paris urban grid fills the frame."
  },
  "probe": {
    "actual_source": "observed baseline run artifacts",
    "capture": [
      "generated_code",
      "execution.success",
      "errors",
      "scene_state",
      "screenshot_quality"
    ],
    "snapshot_before_and_after": false
  },
  "prompt": "Use lookAt to view the Eiffel Tower (48.8584 N, 2.2945 E) from the east side, looking west toward the tower. Position the camera at 1200 meters distance with a 20-degree downward angle. I want to see the Champ de Mars stretching out behind the tower to the west.",
  "schema_version": 1,
  "skill": "cesiumjs-camera",
  "timeout_ms": 5000
}
