{
  "category": "archive_baseline_review",
  "checks": [
    {
      "category": "execution_health",
      "critical": true,
      "description": "No JS errors",
      "id": "no_runtime_errors_00",
      "type": "no_runtime_errors"
    },
    {
      "category": "execution_health",
      "critical": true,
      "description": "No runtime exceptions",
      "id": "code_runs_01",
      "type": "code_runs"
    },
    {
      "category": "generated_output_semantics",
      "critical": true,
      "description": "Uses URL template imagery provider",
      "id": "pattern_present_02",
      "pattern": "UrlTemplateImageryProvider",
      "type": "pattern_present"
    },
    {
      "category": "generated_output_semantics",
      "critical": true,
      "description": "Sets tight rectangle bounds",
      "id": "pattern_present_03",
      "pattern": "rectangle",
      "type": "pattern_present"
    },
    {
      "category": "generated_output_semantics",
      "critical": true,
      "description": "Uses imagery performance level limits",
      "id": "pattern_present_04",
      "pattern": "minimumTerrainLevel|maximumTerrainLevel",
      "type": "pattern_present"
    },
    {
      "category": "generated_output_semantics",
      "critical": true,
      "description": "Targets Hawaii region",
      "id": "pattern_present_05",
      "pattern": "-160|-155|19\\.|22\\.",
      "type": "pattern_present"
    }
  ],
  "critical": false,
  "description": "Exercise the performance guidance by configuring a regional imagery provider with tight bounds and level limits over Hawaii.",
  "id": "eval-115",
  "name": "archive-regional-provider-performance-hawaii",
  "notes": "Imported from optimization/scenarios/cesiumjs-imagery/eval-015. Expected source/runtime contracts are scenario-authored; actual values are observed from the archived baseline generated JS and browser artifacts.",
  "preflight": {
    "difficulty": "medium",
    "expected_behaviors": [
      "Uses UrlTemplateImageryProvider",
      "Sets a tight rectangle for a regional provider",
      "Sets minimumTerrainLevel or maximumTerrainLevel",
      "Frames Hawaii closely"
    ],
    "landmark": "Hawaiian Islands, USA",
    "perspective": "regional bounded imagery provider",
    "source": "optimization/scenarios",
    "source_name": "regional-provider-performance-hawaii",
    "source_scenario_id": "eval-015",
    "visual_expectations": "A visible regional view of the Hawaiian island chain on a light map. The screenshot should not be mostly black; it should visibly focus on Hawaii rather than a global map, and the code should clearly demonstrate bounded regional-provider configuration. The visual assessment uses a four-shot cardinal panorama (north, east, south, west) from the settled viewer state; the subject should remain understandable across the panorama, and grading considers all screenshots together.",
    "screenshot_mode": "cardinal_panorama"
  },
  "probe": {
    "actual_source": "observed baseline run artifacts",
    "capture": [
      "generated_code",
      "execution.success",
      "errors",
      "scene_state",
      "screenshot_quality"
    ],
    "snapshot_before_and_after": false
  },
  "prompt": "Create a CesiumJS viewer centered on the Hawaiian Islands using a regional imagery layer built with UrlTemplateImageryProvider. Use a visible light public basemap, not a mostly black or night-only base layer. Constrain the provider with a tight rectangle around Hawaii and set minimumTerrainLevel or maximumTerrainLevel so the layer is clearly intended for a limited zoom range. Keep the final view zoomed to the island chain so the bounded regional imagery is visible in the screenshot.",
  "schema_version": 1,
  "skill": "cesiumjs-imagery",
  "timeout_ms": 5000
}
