{
  "category": "archive_baseline_review",
  "checks": [
    {
      "category": "execution_health",
      "critical": true,
      "description": "No JS errors",
      "id": "no_runtime_errors_00",
      "type": "no_runtime_errors"
    },
    {
      "category": "execution_health",
      "critical": true,
      "description": "No runtime exceptions",
      "id": "code_runs_01",
      "type": "code_runs"
    },
    {
      "category": "generated_output_semantics",
      "critical": true,
      "description": "Uses explicit tile discard policy",
      "id": "pattern_present_02",
      "pattern": "NeverTileDiscardPolicy",
      "type": "pattern_present"
    },
    {
      "category": "generated_output_semantics",
      "critical": true,
      "description": "Uses URL template provider",
      "id": "pattern_present_03",
      "pattern": "UrlTemplateImageryProvider",
      "type": "pattern_present"
    },
    {
      "category": "generated_output_semantics",
      "critical": true,
      "description": "Targets Iceland",
      "id": "pattern_present_04",
      "pattern": "-19|64\\.",
      "type": "pattern_present"
    }
  ],
  "critical": false,
  "description": "Use a UrlTemplate provider with an explicit NeverTileDiscardPolicy and frame Iceland. This mainly verifies the policy wiring while still producing a visible scene.",
  "id": "eval-113",
  "name": "archive-never-discard-policy-iceland",
  "notes": "Imported from optimization/scenarios/cesiumjs-imagery/eval-013. Expected source/runtime contracts are scenario-authored; actual values are observed from the archived baseline generated JS and browser artifacts.",
  "preflight": {
    "difficulty": "medium",
    "expected_behaviors": [
      "Uses UrlTemplateImageryProvider",
      "Uses NeverTileDiscardPolicy",
      "Frames Iceland"
    ],
    "landmark": "Iceland",
    "perspective": "regional public tile layer with explicit discard policy",
    "source": "optimization/scenarios",
    "source_name": "never-discard-policy-iceland",
    "source_scenario_id": "eval-013",
    "visual_expectations": "A visible map of Iceland. The discard policy is not directly visible, but the imagery should render successfully."
  },
  "probe": {
    "actual_source": "observed baseline run artifacts",
    "capture": [
      "generated_code",
      "execution.success",
      "errors",
      "scene_state",
      "screenshot_quality"
    ],
    "snapshot_before_and_after": false
  },
  "prompt": "Create a CesiumJS viewer centered on Iceland using a public tile URL template for the visible imagery, and explicitly configure a NeverTileDiscardPolicy on the UrlTemplateImageryProvider. The final viewer should show Iceland with a normal map image while the code demonstrates the discard-policy configuration.",
  "schema_version": 1,
  "skill": "cesiumjs-imagery",
  "timeout_ms": 5000
}
