{
  "category": "archive_baseline_review",
  "checks": [
    {
      "category": "execution_health",
      "critical": true,
      "description": "No JS errors",
      "id": "no_runtime_errors_00",
      "type": "no_runtime_errors"
    },
    {
      "category": "execution_health",
      "critical": true,
      "description": "No runtime exceptions",
      "id": "code_runs_01",
      "type": "code_runs"
    },
    {
      "category": "generated_output_semantics",
      "critical": true,
      "description": "Sets custom home rectangle",
      "id": "pattern_present_02",
      "pattern": "DEFAULT_VIEW_RECTANGLE",
      "type": "pattern_present"
    },
    {
      "category": "generated_output_semantics",
      "critical": true,
      "description": "Creates rectangle from degrees",
      "id": "pattern_present_03",
      "pattern": "Rectangle\\.fromDegrees|fromDegrees",
      "type": "pattern_present"
    },
    {
      "category": "generated_output_semantics",
      "critical": true,
      "description": "Calls flyHome",
      "id": "pattern_present_04",
      "pattern": "flyHome",
      "type": "pattern_present"
    }
  ],
  "critical": false,
  "description": "Override the default home view with Camera.DEFAULT_VIEW_RECTANGLE and call flyHome. Tests the flyHome section of the skill.",
  "id": "eval-112",
  "name": "archive-flyhome-custom-default-europe",
  "notes": "Imported from optimization/scenarios/cesiumjs-camera/eval-012. Expected source/runtime contracts are scenario-authored; actual values are observed from the archived baseline generated JS and browser artifacts.",
  "preflight": {
    "difficulty": "medium",
    "expected_behaviors": [
      "Sets Camera.DEFAULT_VIEW_RECTANGLE to a Rectangle covering Europe",
      "Uses Rectangle.fromDegrees with correct Europe bounds",
      "Calls camera.flyHome(2.0) with duration",
      "Starts camera at a different position first"
    ],
    "landmark": "Europe",
    "perspective": "custom home view",
    "source": "optimization/scenarios",
    "source_name": "flyhome-custom-default-europe",
    "source_scenario_id": "eval-012",
    "visual_expectations": "After the flyHome animation, the view should show Europe \u2014 the Mediterranean, UK, Scandinavia, and Eastern Europe should be visible in a roughly rectangular framing. The visual assessment uses a four-shot cardinal panorama (north, east, south, west) from the settled viewer state; the subject should remain understandable across the panorama, and grading considers all screenshots together.",
    "screenshot_mode": "cardinal_panorama"
  },
  "probe": {
    "actual_source": "observed baseline run artifacts",
    "capture": [
      "generated_code",
      "execution.success",
      "errors",
      "scene_state",
      "screenshot_quality"
    ],
    "snapshot_before_and_after": false
  },
  "prompt": "Set the default CesiumJS home view to show Europe (from 35N to 60N, 10W to 40E) instead of the default global view. Then fly the camera home to this view with a 2-second animation. Start with the camera somewhere else first so the flyHome animation is visible.",
  "schema_version": 1,
  "skill": "cesiumjs-camera",
  "timeout_ms": 5000
}
